{
  "schemaVersion" : 1,
  "status" : "FEASIBLE",
  "kernelVersion" : "1.0.0-SNAPSHOT",
  "correlationId" : "bundled-english-b",
  "elapsedTimeMs" : 0,
  "schoolId" : "demo-meadowbrook-school",
  "catalogVersion" : 9,
  "inputRevision" : "sha256:c16d0be2ae1c1770dc846fe6e8e4f8ae4733738506c056ea0b5fd95d7ac2cefe",
  "effectiveSoftWeights" : {
    "soft.teacher-gap" : 1,
    "soft.cohort-gap" : 1,
    "soft.cohort-late-start" : 1,
    "soft.cohort-week-balance" : 1,
    "soft.series-same-day" : 1,
    "soft.undesirable-period" : 1,
    "soft.non-preferred-room" : 1
  },
  "seed" : 0,
  "limit" : {
    "type" : "STEP",
    "steps" : 1
  },
  "terminationReason" : "STEP_LIMIT",
  "timetable" : {
    "assignments" : [ {
      "lessonId" : "meadowbrook-lesson-1A-art-1",
      "subjectId" : "meadowbrook-subject-art",
      "cohortId" : "meadowbrook-cohort-1A",
      "teacherId" : "meadowbrook-teacher-art-1",
      "periodId" : "meadowbrook-period-4-4",
      "roomId" : "meadowbrook-room-art-1"
    }, {
      "lessonId" : "meadowbrook-lesson-1A-art-2",
      "subjectId" : "meadowbrook-subject-art",
      "cohortId" : "meadowbrook-cohort-1A",
      "teacherId" : "meadowbrook-teacher-art-1",
      "periodId" : "meadowbrook-period-5-1",
      "roomId" : "meadowbrook-room-art-1"
    }, {
      "lessonId" : "meadowbrook-lesson-1A-computing-1",
      "subjectId" : "meadowbrook-subject-computing",
      "cohortId" : "meadowbrook-cohort-1A",
      "teacherId" : "meadowbrook-teacher-computing-1",
      "periodId" : "meadowbrook-period-2-5",
      "roomId" : "meadowbrook-room-computing-1"
    }, {
      "lessonId" : "meadowbrook-lesson-1A-english-1",
      "subjectId" : "meadowbrook-subject-english",
      "cohortId" : "meadowbrook-cohort-1A",
      "teacherId" : "meadowbrook-teacher-primary-1",
      "periodId" : "meadowbrook-period-2-4",
      "roomId" : "meadowbrook-room-1A"
    }, {
      "lessonId" : "meadowbrook-lesson-1A-english-2",
      "subjectId" : "meadowbrook-subject-english",
      "cohortId" : "meadowbrook-cohort-1A",
      "teacherId" : "meadowbrook-teacher-primary-1",
      "periodId" : "meadowbrook-period-1-5",
      "roomId" : "meadowbrook-room-1A"
    }, {
      "lessonId" : "meadowbrook-lesson-1A-english-3",
      "subjectId" : "meadowbrook-subject-english",
      "cohortId" : "meadowbrook-cohort-1A",
      "teacherId" : "meadowbrook-teacher-primary-1",
      "periodId" : "meadowbrook-period-4-3",
      "roomId" : "meadowbrook-room-1A"
    }, {
      "lessonId" : "meadowbrook-lesson-1A-english-4",
      "subjectId" : "meadowbrook-subject-english",
      "cohortId" : "meadowbrook-cohort-1A",
      "teacherId" : "meadowbrook-teacher-primary-1",
      "periodId" : "meadowbrook-period-3-5",
      "roomId" : "meadowbrook-room-1A"
    }, {
      "lessonId" : "meadowbrook-lesson-1A-english-5",
      "subjectId" : "meadowbrook-subject-english",
      "cohortId" : "meadowbrook-cohort-1A",
      "teacherId" : "meadowbrook-teacher-primary-1",
      "periodId" : "meadowbrook-period-1-2",
      "roomId" : "meadowbrook-room-1A"
    }, {
      "lessonId" : "meadowbrook-lesson-1A-english-6",
      "subjectId" : "meadowbrook-subject-english",
      "cohortId" : "meadowbrook-cohort-1A",
      "teacherId" : "meadowbrook-teacher-primary-1",
      "periodId" : "meadowbrook-period-5-2",
      "roomId" : "meadowbrook-room-1A"
    }, {
      "lessonId" : "meadowbrook-lesson-1A-english-7",
      "subjectId" : "meadowbrook-subject-english",
      "cohortId" : "meadowbrook-cohort-1A",
      "teacherId" : "meadowbrook-teacher-primary-1",
      "periodId" : "meadowbrook-period-5-3",
      "roomId" : "meadowbrook-room-1A"
    }, {
      "lessonId" : "meadowbrook-lesson-1A-geography-1",
      "subjectId" : "meadowbrook-subject-geography",
      "cohortId" : "meadowbrook-cohort-1A",
      "teacherId" : "meadowbrook-teacher-primary-1",
      "periodId" : "meadowbrook-period-1-1",
      "roomId" : "meadowbrook-room-1A"
    }, {
      "lessonId" : "meadowbrook-lesson-1A-history-1",
      "subjectId" : "meadowbrook-subject-history",
      "cohortId" : "meadowbrook-cohort-1A",
      "teacherId" : "meadowbrook-teacher-primary-1",
      "periodId" : "meadowbrook-period-4-2",
      "roomId" : "meadowbrook-room-1A"
    }, {
      "lessonId" : "meadowbrook-lesson-1A-maths-1",
      "subjectId" : "meadowbrook-subject-maths",
      "cohortId" : "meadowbrook-cohort-1A",
      "teacherId" : "meadowbrook-teacher-primary-1",
      "periodId" : "meadowbrook-period-1-4",
      "roomId" : "meadowbrook-room-1A"
    }, {
      "lessonId" : "meadowbrook-lesson-1A-maths-2",
      "subjectId" : "meadowbrook-subject-maths",
      "cohortId" : "meadowbrook-cohort-1A",
      "teacherId" : "meadowbrook-teacher-primary-1",
      "periodId" : "meadowbrook-period-2-1",
      "roomId" : "meadowbrook-room-1A"
    }, {
      "lessonId" : "meadowbrook-lesson-1A-maths-3",
      "subjectId" : "meadowbrook-subject-maths",
      "cohortId" : "meadowbrook-cohort-1A",
      "teacherId" : "meadowbrook-teacher-primary-1",
      "periodId" : "meadowbrook-period-3-2",
      "roomId" : "meadowbrook-room-1A"
    }, {
      "lessonId" : "meadowbrook-lesson-1A-maths-4",
      "subjectId" : "meadowbrook-subject-maths",
      "cohortId" : "meadowbrook-cohort-1A",
      "teacherId" : "meadowbrook-teacher-primary-1",
      "periodId" : "meadowbrook-period-4-5",
      "roomId" : "meadowbrook-room-1A"
    }, {
      "lessonId" : "meadowbrook-lesson-1A-maths-5",
      "subjectId" : "meadowbrook-subject-maths",
      "cohortId" : "meadowbrook-cohort-1A",
      "teacherId" : "meadowbrook-teacher-primary-1",
      "periodId" : "meadowbrook-period-5-5",
      "roomId" : "meadowbrook-room-1A"
    }, {
      "lessonId" : "meadowbrook-lesson-1A-music-1",
      "subjectId" : "meadowbrook-subject-music",
      "cohortId" : "meadowbrook-cohort-1A",
      "teacherId" : "meadowbrook-teacher-music-1",
      "periodId" : "meadowbrook-period-3-3",
      "roomId" : "meadowbrook-room-music-1"
    }, {
      "lessonId" : "meadowbrook-lesson-1A-pe-1",
      "subjectId" : "meadowbrook-subject-pe",
      "cohortId" : "meadowbrook-cohort-1A",
      "teacherId" : "meadowbrook-teacher-pe-1",
      "periodId" : "meadowbrook-period-1-3",
      "roomId" : "meadowbrook-room-pe-1"
    }, {
      "lessonId" : "meadowbrook-lesson-1A-pe-2",
      "subjectId" : "meadowbrook-subject-pe",
      "cohortId" : "meadowbrook-cohort-1A",
      "teacherId" : "meadowbrook-teacher-pe-1",
      "periodId" : "meadowbrook-period-2-3",
      "roomId" : "meadowbrook-room-pe-1"
    }, {
      "lessonId" : "meadowbrook-lesson-1A-pshe-1",
      "subjectId" : "meadowbrook-subject-pshe",
      "cohortId" : "meadowbrook-cohort-1A",
      "teacherId" : "meadowbrook-teacher-primary-1",
      "periodId" : "meadowbrook-period-4-1",
      "roomId" : "meadowbrook-room-1A"
    }, {
      "lessonId" : "meadowbrook-lesson-1A-pshe-2",
      "subjectId" : "meadowbrook-subject-pshe",
      "cohortId" : "meadowbrook-cohort-1A",
      "teacherId" : "meadowbrook-teacher-primary-1",
      "periodId" : "meadowbrook-period-5-4",
      "roomId" : "meadowbrook-room-1A"
    }, {
      "lessonId" : "meadowbrook-lesson-1A-science-1",
      "subjectId" : "meadowbrook-subject-science",
      "cohortId" : "meadowbrook-cohort-1A",
      "teacherId" : "meadowbrook-teacher-primary-1",
      "periodId" : "meadowbrook-period-3-4",
      "roomId" : "meadowbrook-room-1A"
    }, {
      "lessonId" : "meadowbrook-lesson-1A-science-2",
      "subjectId" : "meadowbrook-subject-science",
      "cohortId" : "meadowbrook-cohort-1A",
      "teacherId" : "meadowbrook-teacher-primary-1",
      "periodId" : "meadowbrook-period-2-2",
      "roomId" : "meadowbrook-room-1A"
    }, {
      "lessonId" : "meadowbrook-lesson-1A-technology-1",
      "subjectId" : "meadowbrook-subject-technology",
      "cohortId" : "meadowbrook-cohort-1A",
      "teacherId" : "meadowbrook-teacher-technology-1",
      "periodId" : "meadowbrook-period-3-1",
      "roomId" : "meadowbrook-room-technology-1"
    }, {
      "lessonId" : "meadowbrook-lesson-1B-art-1",
      "subjectId" : "meadowbrook-subject-art",
      "cohortId" : "meadowbrook-cohort-1B",
      "teacherId" : "meadowbrook-teacher-art-2",
      "periodId" : "meadowbrook-period-3-4",
      "roomId" : "meadowbrook-room-art-1"
    }, {
      "lessonId" : "meadowbrook-lesson-1B-art-2",
      "subjectId" : "meadowbrook-subject-art",
      "cohortId" : "meadowbrook-cohort-1B",
      "teacherId" : "meadowbrook-teacher-art-2",
      "periodId" : "meadowbrook-period-4-5",
      "roomId" : "meadowbrook-room-art-1"
    }, {
      "lessonId" : "meadowbrook-lesson-1B-computing-1",
      "subjectId" : "meadowbrook-subject-computing",
      "cohortId" : "meadowbrook-cohort-1B",
      "teacherId" : "meadowbrook-teacher-computing-2",
      "periodId" : "meadowbrook-period-1-5",
      "roomId" : "meadowbrook-room-computing-1"
    }, {
      "lessonId" : "meadowbrook-lesson-1B-english-1",
      "subjectId" : "meadowbrook-subject-english",
      "cohortId" : "meadowbrook-cohort-1B",
      "teacherId" : "meadowbrook-teacher-primary-2",
      "periodId" : "meadowbrook-period-3-1",
      "roomId" : "meadowbrook-room-1B"
    }, {
      "lessonId" : "meadowbrook-lesson-1B-english-2",
      "subjectId" : "meadowbrook-subject-english",
      "cohortId" : "meadowbrook-cohort-1B",
      "teacherId" : "meadowbrook-teacher-primary-2",
      "periodId" : "meadowbrook-period-1-4",
      "roomId" : "meadowbrook-room-1B"
    }, {
      "lessonId" : "meadowbrook-lesson-1B-english-3",
      "subjectId" : "meadowbrook-subject-english",
      "cohortId" : "meadowbrook-cohort-1B",
      "teacherId" : "meadowbrook-teacher-primary-2",
      "periodId" : "meadowbrook-period-3-5",
      "roomId" : "meadowbrook-room-1B"
    }, {
      "lessonId" : "meadowbrook-lesson-1B-english-4",
      "subjectId" : "meadowbrook-subject-english",
      "cohortId" : "meadowbrook-cohort-1B",